#,Your name,Affiliation (Company / Institute Name),Designation,How long have you been in the company?,What is your total years of experience?,Please enter your email here (preferably company / Institute mail ),Summary of the functions defined in the file,External Links to Documents,Mapping to Developer Details,Mapping to  Target Application Specific Tasks,Basic Summary / Interaction Summary / Algorithm Outline / Dataflow,Installation Requirements / Build Instructions / System Requirements,Other,Data Dependency,Call Order of Functions,Algorithm Outline / Working Summary,Mapping to  Target Application Specific Tasks,Description of the data set / data stores being used,Links to Project Management Details,Description of Parameters and Return Types,Possible Exceptions,Description of External libraries / functions / datatypes used,"Markers -- to show regions (scope) of namespace, class, function etc.",Other,Mapping to  Target Application Specific Tasks,Usage of every import statement,Description of External libraries / functions / datatypes used,Role in the overall design,"Allowed Values, Possible Exceptions",Other,source,Start Date (UTC),Submit Date (UTC),Network ID
9yd51r9rnefetnu1wrjc9yd5149wn4om,Abhinav,Interra Systems India PVT. Ltd.,Principal Engineer,5 years,7 years,abhinav@noida.interrasystems.com,,,Mapping to Developer Details,,Basic Summary / Interaction Summary / Algorithm Outline / Dataflow,,,Data Dependency,,Algorithm Outline / Working Summary,,,,Description of Parameters and Return Types,Possible Exceptions,,,,,,,Role in the overall design,"Allowed Values, Possible Exceptions",,industry,2020-03-03 10:18:48,2020-03-03 10:41:58,5947f5d650
a5f3qlmc3nk32cufa5f3udbr21wnkt92,VIVEK KUMAR UPADHYAY,Interra Systems Pvt. Ltd.,Principal Engineer,3.5 years,6.5 years,viveku@noida.interrasystems.com,Summary of the functions defined in the file,,,,Basic Summary / Interaction Summary / Algorithm Outline / Dataflow,,,,,Algorithm Outline / Working Summary,,,,Description of Parameters and Return Types,Possible Exceptions,,,,,Usage of every import statement,Description of External libraries / functions / datatypes used,Role in the overall design,,,xxxxx,2020-03-03 09:15:09,2020-03-03 09:45:43,5947f5d650
b1g1cyxx808xsrab1v6jjzqgxwnwhav6,Prasun,Synopsys,R&D Engineer,3 years,14,cse.prasun@gmail.com,,,,,Basic Summary / Interaction Summary / Algorithm Outline / Dataflow,,,,,Algorithm Outline / Working Summary,,,,,Possible Exceptions,,,,,,,,"Allowed Values, Possible Exceptions",,xxxxx,2020-02-26 19:30:47,2020-02-26 19:33:02,edc547b1db
jja9w0udc79sipcvbm7ezjja9w0u9h9w,Mahantesh,Synopsys,Principal Engineer,15,20,mdnarwade@yahoo.com,Summary of the functions defined in the file,,Mapping to Developer Details,,Basic Summary / Interaction Summary / Algorithm Outline / Dataflow,,,,,Algorithm Outline / Working Summary,Mapping to  Target Application Specific Tasks,,,,,,,,Mapping to  Target Application Specific Tasks,,,Role in the overall design,"Allowed Values, Possible Exceptions",,xxxxx,2020-02-24 06:41:18,2020-02-24 06:43:35,1b249425df
pv6d97iuyvbmbc92pv6d9wte87zemf48,Govind S Yadav,Interra Systems Pvt. Ltd.,Principal Engineer,7 years,7 years,govind@noida.interrasystems.com,,,,,Basic Summary / Interaction Summary / Algorithm Outline / Dataflow,,,,,Algorithm Outline / Working Summary,,,,,,,,,,,,Role in the overall design,"Allowed Values, Possible Exceptions",,xxxxx,2020-02-07 07:29:36,2020-02-07 07:46:42,5947f5d650
5jabhqwnurox5rsd25jabhyd7frwkpbk,Swarup Pattanayak,Synopsys,Principal Engineer,15,19.5,pswarup@synopsys.com,,External Links to Documents,,,Basic Summary / Interaction Summary / Algorithm Outline / Dataflow,,,Data Dependency,,Algorithm Outline / Working Summary,,Description of the data set / data stores being used,,Description of Parameters and Return Types,Possible Exceptions,,"Markers -- to show regions (scope) of namespace, class, function etc.",,,,,Role in the overall design,"Allowed Values, Possible Exceptions",,xxxxx,2020-02-04 12:29:08,2020-02-04 13:42:50,dcc4f09b4c
x4oc7mylnj37l3b7x97x4oc7myykn2ch,Subhamoy Pal,Synopsys,R&D Engineer,15,15,subhamoy@synopsys.com,,,,,,,Disclaimer ,,,Algorithm Outline / Working Summary,,,,Description of Parameters and Return Types,,,,,,,,Role in the overall design,,,xxxxx,2020-02-04 11:02:50,2020-02-04 11:06:38,669958af1f
